{
  "name": "James Alderton",
  "role": "Creative Director, Alderton & Associates",
  "quote": "I've seen a lot of performers over the years. Victor is different. He's not performing tricks — he's having a conversation with your unconscious mind. I still don't know what happened.",
  "featured": true
}
