{
  "name": "Priya Nair",
  "role": "Wedding Planner, Ivory & Obsidian Events",
  "quote": "Our clients specifically requested something no one at their wedding had experienced before. Victor delivered that, and then some. He's the first performer I've booked twice in the same year.",
  "featured": true
}
