{
  "name": "Daniel Okafor",
  "role": "Programme Director, Northlight Festival",
  "quote": "Sold out in two days. Standing ovation both nights. The only performer we've ever had to add a third date for. The audience feedback was unlike anything we'd received in fifteen years of programming.",
  "featured": false
}
